{
  "$schema": "../../../schemas/recipe.schema.json",
  "id": "tooltip",
  "platform": "web",
  "contractVersion": "2.0.0",
  "generatedFrom": "components/tooltip.contract.json",
  "variants": {
    "top": {
      "tailwind": "absolute bottom-full left-1/2 -translate-x-1/2 mb-2 bg-slate-600 text-white text-sm rounded-lg shadow-sm px-3 py-2 max-w-xs"
    },
    "bottom": {
      "tailwind": "absolute top-full left-1/2 -translate-x-1/2 mt-2 bg-slate-600 text-white text-sm rounded-lg shadow-sm px-3 py-2 max-w-xs"
    },
    "left": {
      "tailwind": "absolute right-full top-1/2 -translate-y-1/2 mr-2 bg-slate-600 text-white text-sm rounded-lg shadow-sm px-3 py-2 max-w-xs"
    },
    "right": {
      "tailwind": "absolute left-full top-1/2 -translate-y-1/2 ml-2 bg-slate-600 text-white text-sm rounded-lg shadow-sm px-3 py-2 max-w-xs"
    }
  }
}
