{
  "$schema": "../../../schemas/recipe.schema.json",
  "id": "avatar",
  "platform": "web",
  "contractVersion": "2.0.0",
  "generatedFrom": "components/avatar.contract.json",
  "variants": {
    "image": {
      "tailwind": "w-10 h-10 rounded-full object-cover"
    },
    "initials": {
      "tailwind": "w-10 h-10 rounded-full bg-primary-50 text-primary-600 font-medium inline-flex items-center justify-center text-sm"
    },
    "group": {
      "tailwind": "flex -space-x-2"
    }
  },
  "sizes": {
    "small": {
      "tailwind": "w-8 h-8"
    },
    "medium": {
      "tailwind": "w-10 h-10"
    },
    "large": {
      "tailwind": "w-12 h-12"
    }
  }
}
