{
  "$schema": "../../../schemas/recipe.schema.json",
  "id": "copy-button",
  "platform": "web",
  "contractVersion": "2.0.0",
  "generatedFrom": "components/copy-button.contract.json",
  "variants": {
    "outlined": {
      "tailwind": "bg-white border border-slate-200 inline-flex items-center justify-center cursor-pointer"
    },
    "subtle": {
      "tailwind": "bg-transparent inline-flex items-center justify-center cursor-pointer hover:bg-gray-50"
    }
  },
  "sizes": {
    "large": {
      "tailwind": "w-12 h-12 p-3 rounded-2xl"
    },
    "medium": {
      "tailwind": "w-10 h-10 p-2.5 rounded-xl"
    },
    "small": {
      "tailwind": "w-8 h-8 p-2 rounded-lg"
    }
  }
}
