{
  "$schema": "../../../schemas/recipe.schema.json",
  "id": "checkbox",
  "platform": "web",
  "contractVersion": "2.0.0",
  "generatedFrom": "components/checkbox.contract.json",
  "variants": {
    "default": {
      "tailwind": "w-4 h-4 accent-primary-500 cursor-pointer"
    },
    "disabled": {
      "tailwind": "w-4 h-4 opacity-50 cursor-not-allowed"
    },
    "indeterminate": {
      "tailwind": "w-4 h-4 accent-primary-500 cursor-pointer"
    }
  }
}
