{
  "$schema": "../../../schemas/recipe.schema.json",
  "id": "datepicker",
  "platform": "web",
  "contractVersion": "2.0.0",
  "generatedFrom": "components/datepicker.contract.json",
  "variants": {
    "trigger": {
      "tailwind": "w-full flex items-center gap-2 rounded-lg border border-slate-300 bg-white px-3 py-2 text-base"
    },
    "calendar": {
      "tailwind": "absolute mt-1 w-[320px] bg-white rounded-xl border border-slate-200 shadow-md z-20 p-4"
    },
    "day-cell": {
      "tailwind": "w-10 h-10 inline-flex items-center justify-center text-sm rounded-lg"
    }
  },
  "stateSpecs": {
    "open": {
      "tailwind": ""
    },
    "selected": {
      "tailwind": "bg-primary-500 text-white hover:bg-primary-600"
    },
    "today": {
      "tailwind": "font-semibold ring-1 ring-inset ring-primary-300"
    },
    "error": {
      "tailwind": "border-red-600"
    },
    "disabled": {
      "tailwind": "opacity-50 cursor-not-allowed pointer-events-none"
    }
  }
}
