{
  "$schema": "../../../schemas/recipe.schema.json",
  "id": "metric",
  "platform": "web",
  "contractVersion": "0.1.0",
  "generatedFrom": "components/metric.contract.json",
  "variants": {
    "default": {
      "tailwind": ""
    }
  },
  "sizes": {
    "sm": {
      "tailwind": ""
    },
    "md": {
      "tailwind": ""
    },
    "lg": {
      "tailwind": ""
    }
  }
}
